cmd,time,loc,pref
강남역 주변에 분위기 좋은 카페를 찾아줘.,없음,강남역,분위기 좋은 카페
나 지금 배고픈데 뭐 먹지?,점심,없음,없음
가로수길에서 소개팅하기 좋은 레스토랑 추천해주세요.,저녁,가로수길,소개팅
내가 좋아하는 사람과 함께 갈만한 분위기 좋은 식당 알려줘.,저녁,없음,분위기 좋은 곳
강남역 근처에서 소개팅하기 좋은 레스토랑을 추천해주세요.,없음,강남역,소개팅 장소
강남역 주변에서 소개팅하기 좋은 레스토랑을 추천해주세요.,없음,강남역,소개팅 장소
강남역 주변에 혼밥할 만한 곳 있나요?,없음,강남역,혼밥
서울 근교의 분위기 좋은 카페를 추천해주세요.,없음,서울,분위기 좋은 카페
제주도 여행가는데 맛집 추천 좀 해주세요!,없음,제주도,없음
서울 근교로 드라이브하기 좋은 곳은 어디일까요?,없음,서울,드라이브
이태원이나 한남동 쪽에 브런치 잘하는 곳이 어디인가요?,아침,이태원,브런치
다음주 월요일 저녁 7시에 서울역 앞에서 만나요!,저녁,서울역,만남
서울에서 맛있는 중국집 알려주세요.,없음,서울,중국집
강남역 주변으로 맛있는 파스타집 있나요?,없음,강남역,파스타
서울 근교 드라이브 코스 추천해주세요.,없음,경기도,없음
"강남에서 모임이 있는데, 어디가 좋을까요?",없음,강남,모임장소
주말에 갈만한 곳을 추천해주세요.,없음,서울,여행지
성수동 카페 어디가 좋아?,없음,성수동,분위기 좋은 카페
강남에서 분위기 좋은 레스토랑을 추천해주세요.,없음,강남,분위기 좋은 레스토랑
건대 주변에서 괜찮은 초밥집은 어디인가요?,없음,건대입구역,초밥
강남역 근처에 분위기 좋은 카페가 있나요?,없음,강남역,분위기 좋은 카페
서울시청 근처 혼밥하기 좋은 곳 알려주세요.,없음,서울시청,혼밥
강남구청역 주변 맛집 알려주세요~,없음,강남구청역,없음
강남역 주변에서 점심 식사로 먹기 좋은 곳 알려줘.,없음,강남역,없음
강남역 주변에 괜찮은 술집 있나요?,저녁,강남역,술집
서울역 근처 괜찮은 레스토랑 있을까요?,없음,서울역,레스토랑
홍대입구역 근처에 맛있는 디저트 가게 알려줘.,없음,홍대입구역,맛있는 디저트
서울에서 분위기 좋은 카페나 술집 알려주세요~,저녁,서울,분위기 좋은 곳
강남역 주변에 갈만한 카페 있나요?,없음,강남역,카페
광화문에 있는 괜찮은 카페 추천해주세요.,없음,광화문,분위기 좋고 커피 맛이 좋은 곳
강남역 근처에 맛있는 파스타집 추천해주세요.,없음,강남역,파스타
오늘 점심 뭐먹지?,없음,없음,없음
오늘 저녁은 뭘 먹을까나~,없음,없음,없음
홍대입구역 근처 혼밥하기 좋은 식당 추천해주세요.,점심,홍대입구역,혼밥하기 좋은 식당
"강남역에서 저녁 먹을 건데, 어디가 좋을까요?",저녁,강남역,없음
여기서 가장 가까운 지하철역은 어디인가요?,없음,없음,역
저녁메뉴로 뭐가 좋을까요?,저녁,서울,메뉴추천
"이번 주말에 친구들이랑 놀러갈건데, 어디가 좋을까?",없음,서울,1박 2일 코스
건대입구역에서 가까운 술집 추천해주세요!,저녁,건대입구역,술집
강남역 주변 맛집 추천해줘.,없음,강남역,없음
홍대입구역 주변에 분위기 좋고 조용한 카페 있나요?,없음,홍대입구역,분위기 좋고 조용한 카페
왕십리에서 분위기 괜찮은 술집이 어디있을까요?,저녁,왕십리역,술집
서울에서 가장 맛있는 빵집은 어디인가요?,없음,서울 전역,빵이 맛있는 곳
홍대입구역 주변에 혼밥하기 좋은 식당 있나요?,없음,홍대입구역,혼밥하기 좋은 식당
서울에 분위기 좋은 레스토랑 추천해주세요.,없음,서울,분위기
서울 근교 드라이브 하기 좋은 곳 알려주세요.,없음,서울,드라이브
오늘 저녁은 뭐 먹지?,저녁,없음,모름
홍대입구역 근처의 괜찮은 카페를 알려주세요.,없음,홍대입구역,괜찮은 카페
이태원 쪽에 분위기 좋은 술집이 있나요?,저녁,이태원동,분위기 좋은 술집
강남역에서 점심먹을건데 맛집 추천해주세요!,점심,강남역,없음
홍대입구역 근처에 분위기 좋은 카페 있나요?,없음,홍대입구역,분위기 좋은 카페
강남역에서 데이트할만한 장소 있나요?,없음,강남역,데이트 코스
요즘은 어떤 옷이 유행인가요?,없음,없음,패션 트렌드
인천공항에서 제일 가까운 호텔이 어디인가요?,없음,인천공항,공항 근처의 호텔
제주도 여행 중인데 흑돼지가 먹고 싶어요. 현지인이 많이 가는 곳 알려주세요.,없음,제주도,흑돼지
서울 근교로 당일치기 여행갈만한 곳 추천해주세요.,없음,서울,당일치기 여행지
혹시 여기서 가까운 편의점이 어디야?,없음,없음,없음
한양대 주변 괜찮은 식당 있나요?,없음,한양대학교,없음
부산에서 서울로 놀러가는데 가볼만한 곳 있을까요?,없음,서울,가볼만한 곳
강남역 근처에 분위기 좋은 레스토랑 좀 알려주세요.,없음,강남역,분위기 좋은 레스토랑
역삼역 근처에 점심으로 먹기 좋은 밥집이 있나요?,점심,역삼역,밥집
혹시 강남역 주변에 괜찮은 술집 있나요?,저녁,강남역,분위기 좋은 술집
홍대입구역 근처에 혼밥하기 좋은 식당이 있을까요?,없음,홍대입구역,혼밥하기 좋은 식당
내일 점심으로 먹을만한 것 좀 추천해줄래?,점심,서울 강남구,없음
강원도 속초여행 계획중인데 가볼만한곳 추천해주세요.,없음,강원도 속초,없음
오늘 저녁은 뭘 먹을까?,없음,없음,없음
홍대입구역 근처 분위기 좋은 카페 있나요?,없음,홍대입구역,분위기 좋은 카페
점심 메뉴 추천해주세요.,점심,없음,없음
여기서 가장 가까운 편의점이 어디야?,없음,없음,편의점
홍대에서 가성비 좋은 술집을 추천해주세요.,저녁,홍대,술집
강남역 근처에 맛있는 곳 있나요?,없음,강남역,없음
"요즘 날씨가 너무 추워져서 따뜻한 국물이 땡기는데, 서울에서 갈만한 샤브샤브 가게 알려주세요.",점심,서울,샤브샤브
강남역 주변에 회식할만한 고기집 있나요?,없음,강남역,회식장소
요즘 뜨는 핫플레이스가 어디야?,없음,없음,없음
강남역 주변에 괜찮은 초밥집 있나요?,없음,강남역,초밥
왕십리에서 가장 가까운 백화점이 어디야?,없음,왕십리,백화점
지금 이 시간대에 갈만한 곳이 어디있을까요?,없음,가로수길,현재 위치를 기반으로 한 장소 검색
한양대역이나 왕십리역 근처에 혼밥하기 좋은 식당이 있나요?,없음,한양대역,혼밥 가능한 식당
강남역 주변에 분위기 좋은 레스토랑 있나요?,없음,강남역,분위기 좋은 레스토랑
오늘 저녁 메뉴는 뭔가요?,없음,없음,없음
이태원의 분위기 좋은 레스토랑 좀 추천해주세요.,점심,이태원,분위기 좋은 레스토랑
여의도 공원 주변에 괜찮은 술집 있나요?,저녁,여의도 공원,술집
홍대에서 맛있는 라멘집 있나요?,없음,홍대,라멘
강남역에서 소개팅 하기 좋은 장소 좀 알려주세요.,없음,강남역,소개팅
홍대입구역 주변 괜찮은 술집 좀 알려줘!,저녁,홍대입구역,좋은 술집
"지금 강남역인데, 점심으로 뭘 먹어야 할지 모르겠어요.",없음,강남역,없음
신림동 순대타운은 어디가 맛있나요?,없음,신림동,순대타운
서울시청 근처에 맛있는 중국집이 어디있나요?,없음,서울시청,중국집
강남역 근처에서 데이트하기 좋은 곳을 알려주세요.,없음,강남역,데이트
"건대입구쪽으로 양꼬치 먹으러 가려고 하는데, 괜찮은 집 있을까요?",없음,건대입구,양꼬치
강남역 주변에 괜찮은 스시집이 어디인가요?,없음,강남역,스시
강남역 맛집 알려주세요~,없음,강남역,없음
강남역 주변 맛집 알려주세요.,없음,강남역,없음
강남역 주변에 회식할만한 장소 추천해주세요.,없음,강남역,회식장소
강남역 근처에 괜찮은 술집 있나요?,저녁,강남역,괜찮은 술집
강남역 주변에서 가볍게 맥주한잔 하고 싶은데 어디가 좋을까요?,없음,강남역,가벼운 술자리
강남역 주변에 맛집 좀 알려주세요~,없음,강남역,없음
강남역 주변 맛집 추천해주세요!,없음,강남역,없음
홍대입구역 근처에 분위기 좋은 레스토랑 좀 소개해주세요.,없음,홍대입구역,분위기 좋은 레스토랑
강남역에서 데이트하기 좋은곳좀 알려주세요!,없음,강남역,데이트코스
제주도 여행코스 추천해주세요.,없음,제주도,없음
강남역 주변에 분위기 좋은 레스토랑을 찾고 있어요. 추천해주세요.,저녁,강남역,레스토랑
"제가 지금 배가 너무 고픈데, 맛있는 식당 좀 알려주세요.",점심,없음,없음
강남역에서 밥먹을건데 뭐가 맛있어?,점심,강남역,맛잇는 것
서울 근교 드라이브 코스 추천해주세요!,없음,서울,드라이브
서울역 근처에 맛집 있나요?,없음,서울역,없음
홍대입구역 근처에서 혼밥하기 좋은 곳 알려주세요!,없음,홍대입구역,혼밥 가능한 식당
홍대입구역 부근으로 분위기 좋은 술집 추천 부탁드려요!,저녁,홍대입구역,분위기 좋은 술집
사당역 주변으로 괜찮은 술집 있나요?,저녁,사당역,안주가 맛있는 술집
홍대입구역 근처에서 한식 잘하는곳 있나요?,없음,홍대입구역,한식
홍대입구역 근처 분위기 좋은 술집 알려주세요.,저녁,홍대입구역,분위기 좋은 술집
성수동 카페거리 예쁜 카페 추천해주세요!,없음,성수동 카페거리,예쁜 카페
강남역 근처 맛집 알려주세요!,점심,강남역,없음
강남역 주변에 점심 먹기 좋은 곳 있나요?,점심,강남역,없음
강남구청역 근처에 맛있는 파스타집을 추천해주세요.,없음,강남구청역,맛있는 파스타
강남역 주변에 괜찮은 술집 있나요?,저녁,강남역,술을 마실 수 있는 곳
강남역 주변에 분위기 좋은 술집 있나요?,저녁,강남역,분위기 좋은 술집
오늘 저녁은 뭘 먹을까요?,없음,없음,없음
"서울에서 저녁식사로 삼겹살을 먹으려고 하는데, 괜찮은 곳 좀 소개해 주세요.",저녁,서울,삼겹살
강남역에서 여자친구랑 데이트 하기 좋은 식당 알려주세요.,점심,강남역,데이트
을지로 3가 역 근처 맛있는 곳 좀 알려줘.,없음,을지로3가,없음
인사동에서 데이트하기 좋은 곳 있나요?,없음,인사동,데이트 코스
강남역에서 소개팅하기 좋은 곳 알려주세요.,없음,강남역,소개팅 장소
이태원 루프탑바 중 분위기 좋고 음식 맛있는 곳 추천해주세요.,저녁,이태원,"루프탑 바, 분위기 좋음, 음식 맛있음"
여의도 한강공원 근처에 치킨 배달 시킬 만한 곳 있니?,없음,여의도 한강공원,치킨 배달
강남에서 갈만한 술집 있나요?,저녁,강남,분위기 좋은 술집
서울 근교로 드라이브 갈만한 곳 있나요?,없음,서울,운전하기 편한 도로
6월 2일 저녁에 친구들이랑 같이 갈만한 강남역 맛집 추천해주세요.,저녁,강남역,친구들과 함께 가기 좋은 식당
이번 주 금요일에 인천에서 소개팅할 분위기 좋은 식당 골라줘.,없음,인천,소개팅하기 좋은 분위기
"출장 중인데, 이 지역에서 유명한 음식점이 있을까요?",없음,없음,없음
부산 해운대 달맞이길 카페 추천해주세요.,없음,달맞이길,카페
점심으로 먹기 좋은 음식점 알려주세요.,점심,없음,없음
강남역에서 혼밥하기 좋은 곳 추천해주세요!,없음,강남역,혼밥
오늘은 뭐 먹지?,없음,없음,없음
강남역에서 가까운 맛집 알려주세요~,점심,강남역,없음
홍대에서 여자친구랑 데이트 할건데 분위기 좋고 가격도 적당한 레스토랑 추천해주세요~,없음,홍대,"분위기, 가격 적당"
강남역에서 혼밥하기 좋은 곳이 어디있을까요?,없음,강남역,혼밥
오늘 저녁은 뭐 먹지?,저녁,없음,없음
강남역 주변 분위기 좋은 술집 있나요?,저녁,강남역,분위기 좋은 술집
강남구청역 근처에 맛있는 고기집 추천해주세요.,없음,강남구청역,맛있는 고기집
강남역 주변에 혼밥하기 좋은 맛집 좀 알려줘.,점심,강남역,혼밥하기 좋은 곳
성수역 근처 카페 추천해주세요!,없음,성수역,카페
압구정로데오역 근처 맛집 알려주세요~,없음,압구정로데오역,없음
이태원 경리단길의 분위기 좋은 카페를 알려주세요.,없음,이태원 경리단길,분위기 좋은 카페
강남역 근처의 맛있는 피자집이 있나요?,점심,강남역,피자
이태원에서 분위기 좋은 펍 추천해주세요.,없음,이태원,분위기 좋은 펍
강남역 맛집 좀 알려주세요.,없음,강남역,없음
홍대입구역 근처에 분위기 좋고 조용한 카페 있나요?,없음,홍대입구역,분위기 좋고 조용한 카페
종로 맛집 알려주세요.,없음,종로,없음
강남역에서 스터디 할만한 카페 있나요?,없음,강남역,스터디 가능한 카페
강남역 근처에 점심으로 먹기 좋은 맛집 있나요?,없음,강남역,없음
홍대 근처의 분위기 좋은 카페를 알려줘.,없음,홍대,분위기 좋은 곳
점심으로 뭐 먹을까?,점심,없음,없음
건대입구역 부근 카페 추천해주세요.,없음,건대입구역,카페
홍대 근처의 가성비 좋은 스테이크집 알려주세요.,없음,홍대,가성비 좋은 스테이크
강남역에서 소개팅하기 좋은 장소 좀 추천해주세요.,없음,강남역,소개팅
성신여대 근처에 혼술하기 좋은 맥주집 추천해주세요.,없음,성신여대,혼술하기 좋은 맥주집
신촌에서 밥 먹을건데 추천해주세요!!,없음,신촌,없음
오늘 점심은 뭐 먹지?,점심,없음,없음
홍대 근처에서 혼밥하기 좋은 곳 추천해주세요.,점심,홍대,혼밥 가능한 식당
오늘 점심은 뭐 먹을까요?,없음,없음,없음
점심으로 먹을 만한 것 좀 추천해주세요.,없음,없음,없음
홍대나 합정 쪽에 괜찮은 이자카야 있어?,없음,홍대,이자카야
점심으로 먹기 좋은 식당 추천해주세요.,점심,없음,없음
강남역 주변에 혼밥하기 좋은 식당이 있을까요?,없음,강남역,혼밥하기 좋은 식당
내일 뭐 먹지?,없음,없음,메뉴 선정
이태원의 분위기 좋은 바 추천해주세요.,저녁,이태원,분위기가 좋아야 함
종로3가에서 가볍게 한잔할곳 있나요?,없음,종로3가,가벼운 술자리
강남역 근처에 분위기 좋은 레스토랑 있나요?,없음,강남역,분위기 좋은 레스토랑
"강남, 역삼 쪽에 분위기 좋은 레스토랑 알려주세요.",없음,강남,분위기 좋은 레스토랑
이태원에서 분위기 좋은 술집 알려주세요~,저녁,이태원,술집
강남역 근처의 맛있는 초밥집 알려줘.,없음,강남역,초밥
"홍대입구역 근처에 분위기 좋고, 음식도 맛있는 식당이 있나요?",없음,홍대입구역,없음
강남역에서 점심 먹을만한 곳 있나요?,점심,강남역,없음
명동맛집추천해주세요!!,없음,명동,없음
강남역 주변에 맛있는 초밥집 있나요?,없음,강남역,초밥
제주도에서 흑돼지를 먹을 수 있는 맛집을 알고 있나요?,없음,제주도,흑돼지
이태원 데이트 코스 알려주세요!,없음,이태원,데이트 코스
강남역 주변 가성비 좋은 초밥집 추천해주세요.,점심,강남역,가성비 좋은 초밥집
강남역 주변에 분위기 좋은 레스토랑 있나요?,없음,강남역,분위기 좋은 레스토랑
서울 근교로 드라이브 갈만한 곳 어디 없을까?,없음,서울,드라이브
서울역 근처의 맛있는 집 추천 부탁드립니다.,없음,서울역,맛있음
홍대에서 소개팅 하기 좋은 곳 있나요?,저녁,홍대,소개팅
강남구청역 근처에 괜찮은 초밥집 추천해주세요.,없음,강남구청역,초밥
서울에서 갈만한 브런치 카페를 추천해주세요.,없음,서울,브런치 카페
홍대 근처에서 소개팅할만한 분위기 좋은 레스토랑 없을까요?,없음,홍대입구역,소개팅하기 좋은 레스토랑
홍대입구역 주변에 괜찮은 초밥집이 있을까요?,점심,홍대입구역,초밥
회사 회식 장소로 좋은 곳을 알려주세요.,저녁,서울시 마포구,고급스러운 분위기의 음식점
영등포역에서 제일 가까운 카페가 어디야?,없음,영등포역,가장 가까운 카페
강남역 주변에 맛집 알려줘~,저녁,강남역,없음
서울 근교로 드라이브를 갈만한 곳이 어디있을까요?,없음,서울,드라이브
저녁으로 먹을만한 거 추천해줘.,저녁,없음,없음
남자친구 생일인데 서울에서 데이트할만한 곳 추천해주세요.,없음,서울,데이트 장소
저녁으로 먹기 좋은 메뉴가 뭐가 있을까요?,저녁,없음,없음
서울 근교 드라이브 코스 추천해주세요.,없음,서울,없음
오늘 저녁엔 뭘 먹을까?,저녁,없음,없음
서울에서 놀만한 곳이 어디있을까요?,없음,서울,놀만한 곳
여기서 제일 가까운 편의점이 어디야?,없음,없음,가장 가까운 편의점
강남구청역 근처에 괜찮은 술집 있나요?,저녁,강남구청역,술집
홍대에 분위기 좋은 술집 있나요?,저녁,홍대,분위기
내일 점심은 어디서 먹을까?,점심,서울,없음
홍대근처의 괜찮은 레스토랑을 알려주세요.,없음,홍대,괜찮은 레스토랑
홍대 놀거리 추천해줘!,없음,홍대입구역,놀 거리
합정역 근처에 분위기 좋은 카페 있나요?,없음,합정역,분위기 좋은 카페
강남역에서 점심 먹을 만한 곳이 있을까요?,점심,강남역,없음
내일 저녁 8시에 어디서 만날까?,저녁,없음,만남
내일 점심은 뭘 먹을까요?,점심,없음,없음
강남역 주변에 소고기 먹을만한 곳 알려주세요~,없음,강남역,소고기
서울역 근처 혼밥하기 좋은 식당 알려주세요!,없음,서울역,혼밥하기 좋은 식당
여의도에서 점심 먹을만한 곳 추천해주세요.,점심,여의도,없음
압구정로데오역 근처에 있는 분위기 좋은 레스토랑을 알려주세요.,없음,압구정로데오역,분위기 좋은 레스토랑
종로3가역 근처에 맛있는 치킨집 어디있나요?,없음,종로3가역,치킨집
강남역에서 혼밥하기 좋은 식당 좀 알려주세요.,없음,강남역,혼밥하기 좋은 식당
오늘 저녁 메뉴 추천해주세요~,저녁,없음,한식
홍대나 신촌에서 분위기 좋은 술집 알려주세요.,저녁,홍대,분위기 좋은 술집
서울역 주변이나 용산구 쪽에 괜찮은 한정식 집 없을까요?,없음,서울역,한정식
대전역 근처에 괜찮은 횟집 좀 알려주세요.,없음,대전역,횟집
강남역 근처에 소개팅할만한 곳 없을까요?,없음,강남역,소개팅 장소
서울에서 가까운 바다 추천해주세요.,없음,없음,바다가 보이는 곳
여기서 제일 가까운 카페가 어디야?,없음,없음,가장 가까운 카페
종로3가 혼밥하기 좋은 식당 추천해주세요.,없음,종로3가,혼밥하기 좋은 식당
점심 뭐먹지?,없음,없음,없음
저녁에 뭘 먹을까?,저녁,없음,없음
친구들과 함께 갈만한 분위기 좋은 카페가 있을까요?,없음,없음,분위기 좋은 카페
강남역 주변에 회식 장소를 알아보고 있는데 어디가 좋을까요?,저녁,강남역,회식장소
왕십리역 근처에 괜찮은 술집 추천해주세요!,저녁,왕십리역,술집
강남역 주변에 괜찮은 고깃집 좀 알려주세요~,없음,강남역,고깃집
내일 점심은 어디서 먹지?,아침,없음,없음
강남역 주변에 맛집 알려주세요.,없음,강남역,없음
강남역에서 가까운 분위기 좋은 레스토랑을 추천해주세요.,없음,강남역,분위기 좋은 레스토랑
수원 영통구 망포동 주변에 괜찮은 중국집 없나요?,없음,망포동,중국집
이번 주말에 뭐하지?,없음,없음,없음
점심으로 어떤걸 먹는게 좋을까요?,점심,없음,없음
다음 주 수요일 저녁에 여자친구랑 갈만한 곳 추천해줘.,없음,없음,여자친구와 함께 방문 예정
강남역 주변에 분위기 좋은 레스토랑 있나요?,없음,강남역,분위기 좋은 레스토랑
이 근처에 맛있는 집 있어?,없음,없음,없음
지금 시간에 문 연 식당이 있을까요?,저녁,없음,24시 음식점
서울에서 맛있는 횟집 좀 알려주세요.,없음,서울,회
강남역 맛집 좀 알려주세요.,저녁,강남역,없음
서울에서 가장 분위기 좋고 맛도 괜찮은 이탈리안 레스토랑이 어디인가요?,없음,서울 전역,이탈리안 레스토랑
성수동에서 분위기 좋은 카페나 레스토랑 추천해주세요.,없음,성수동,분위기 좋은
강남역 주변에 맛집 좀 알려주라!,없음,강남역,없음
지금 당장 갈만한 맛집 좀 알려줘봐~,없음,없음,없음
내일 저녁은 뭘 먹을까?,저녁,없음,없음
강남역 근처에 맛있는 중국집 있나요?,없음,강남역,중식
나 내일 생일인데 뭐 먹을까?,없음,없음,없음
강남역 혼밥하기 좋은 곳 알려주세요~,없음,강남역,혼밥 가능한 곳
건대입구 쪽에 분위기 좋은 술집 있나요?,저녁,건대입구,분위기 좋은 술집
강남역 근처로 친구들이랑 놀러 갈 건데 놀 만한 곳 좀 알려줘.,없음,강남역,놀 만한 곳
혹시 홍대쪽에 괜찮은 술집 있나요?,저녁,홍대,분위기 좋고 안주가 맛있는 술집
강남역 쪽에 괜찮은 술집 있나요?,저녁,강남역,없음
홍대입구역 근처에서 친구들과 함께 갈만한 맛집 좀 알려줘.,없음,홍대입구역,없음
강남역 주변에 분위기 좋은 레스토랑 알려주세요.,없음,강남역,분위기
서울역 근처에 괜찮은 식당 있나요?,없음,서울역,없음
홍대입구역 근처 가성비 좋은 술집 알려주세요.,저녁,홍대입구역,가성비 좋은 술집
내일 저녁으로 뭘 먹을까 고민중인데 추천해주세요!,없음,없음,없음
점심에 먹기 좋은 메뉴를 추천해주세요.,점심,역삼동,없음
여자친구와 데이트할 때 갈만한 분위기 좋은 레스토랑 추천해주세요.,점심,홍대입구역,분위기 좋은 레스토랑
강남역 근처에서 소개팅하기 좋은 장소 알려줘.,없음,서울 강남역,소개팅
점심으로 먹기 좋은 음식 추천해주세요.,점심,없음,없음
서울에 있는 분위기 좋은 레스토랑 추천해줘.,저녁,서울,분위기 좋은 레스토랑
한양대 근처에 괜찮은 카페 있어?,없음,한양대학교,카페
서울에서 맛있는 식당 알려주세요.,점심,서울,맛이 중요함
서울역 근처에 맛있는 초밥집이 있나요?,없음,서울역,초밥
강남역 근처에 분위기 좋은 카페 어디있나요?,없음,강남역,분위기 좋은 카페
왕십리역 근처 분위기 좋은 술집이나 카페 좀 알려주세요.,저녁,왕십리역,"분위기 좋은 술집, 카페"
부산에 있는 호텔 뷔페를 예약하고 싶은데 어떻게 해야 하나요?,없음,부산,호텔 뷔페 예약
이태원 경리단길 분위기 좋은 카페 추천해주세요.,없음,이태원 경리단길,분위기 좋은 카페
건대입구역 주변의 분위기 좋은 레스토랑 추천해주세요.,점심,건대입구역,분위기 좋은 레스토랑
제주도 여행지 추천해주세요.,없음,제주도,없음
오늘 점심은 뭐 먹지?,점심,없음,없음
강남역근처 혼밥할만한곳 알려주세요!,없음,강남역,혼밥
오늘 저녁은 뭘 먹을까요?,없음,없음,없음
강남역 주변으로 분위기 좋은 술집 알려주세요.,저녁,강남역,분위기 좋은 술집
이태원이나 한남동 부근에 와인바 좀 추천해주세요.,없음,이태원,와인바
역삼동 맛집 알려줘~,없음,역삼동,없음
강남역 주변에 분위기 좋은 카페나 바 있어?,없음,강남역,분위기 좋은 카페 또는 바
강남역 근처에 맛있는 삼겹살집 있나요?,없음,강남역,삼겹살
홍대입구역에서 가까운 분위기 좋은 술집 알려줘.,저녁,홍대입구역,분위기 좋은 술집
지금 부산 해운대입니다. 저녁을 먹어야 하는데 어디가 좋을까요?,없음,부산 해운대,없음
홍대입구역 근처에 분위기 좋은 레스토랑이 있을까요?,없음,홍대입구역,분위기 좋은 레스토랑
강남역 주변에 괜찮은 식당 있나요?,없음,강남역,없음
혹시 너네 집 주변에 괜찮은 술집 있나?,저녁,없음,분위기 좋은 술집
"여자친구랑 데이트 할건데, 가로수길이나 압구정로데오쪽으로 맛있는 곳 알려줘!",없음,가로수길,맛이 있어야 함
점심으로 먹기 좋은 음식점 알려주세요.,없음,없음,없음
홍대입구역 근처 점심으로 먹을만한곳 추천해주세요~,없음,홍대입구역,없음
